{
  "schema_version": "prowl-heldout-receipt-v2",
  "status": "not_created",
  "owner": "Quinton Evans",
  "corpus_content_sha256": "6978c2f0aaef592efaec76792c615d2fd96e63fde37688d0b595e2f003baeb8d",
  "final_development_content_sha256": null,
  "protected_content_manifest_sha256": null,
  "encrypted_image_sha256": null,
  "independent_encrypted_backup_sha256": null,
  "question_count": null,
  "answerable_count": null,
  "unsupported_or_refused_count": null,
  "unresolved_label_count": null,
  "maximum_single_gold_source_question_count": null,
  "answerable_family_counts": null,
  "difficulty_counts": null,
  "independent_authorship_attested": false,
  "protected_content_mechanically_validated": false,
  "quinton_semantic_adjudication_complete": false,
  "quinton_second_consistency_pass_complete": false,
  "cross_split_near_duplicate_review_complete": false,
  "regression_exposure_review_complete": false,
  "source_concentration_review_complete": false,
  "storage_allocation_confirmed": false,
  "independent_backup_hash_verified": false,
  "protected_image_unmounted_after_freeze": false,
  "freeze_date": null
}
